{
  "schema_version": "1.0",
  "report_types": ["binary-size"],
  "target": {
    "name": "libdemo.so",
    "kind": "binary",
    "repo_root": "/repo/demo",
    "commit": "987654",
    "build_config": "release",
    "platform": {"os": "linux", "arch": "x86_64"}
  },
  "source_reports": [
    {
      "id": "S1",
      "path": "size-after.json",
      "source_format": "analyzer-json",
      "parser": "structured",
      "confidence": 0.95
    }
  ],
  "run_context": {
    "device": "host",
    "cpu_governor": "unknown",
    "core_count": 8,
    "repeat_count": 1,
    "warmup_count": 0
  },
  "findings": [
    {
      "id": "F001",
      "kind": "binary-size-regression",
      "title": ".text grew by 16KB",
      "source_ref": {"source_id": "S1", "locator": "$.sections['.text']", "label": ".text"},
      "evidence": {
        "metric": "section_bytes",
        "value": 81920,
        "unit": "bytes",
        "section": ".text",
        "file": "libdemo.so",
        "baseline": {"value": 65536, "label": "main@123456"},
        "delta": {"abs": 16384, "pct": 25.0, "direction": "increase"}
      },
      "diagnosis": "Text section grew relative to the baseline build.",
      "confidence": 0.9
    }
  ],
  "provenance": {
    "generated_by": "m0.5-fixture",
    "version": "1.0.0",
    "timestamp": "2026-05-25T00:00:00Z"
  }
}
