{
  "schema_version": "1.0",
  "report_types": ["binary-size"],
  "target": {
    "name": "libdemo.so",
    "kind": "binary",
    "repo_root": "/repo/demo",
    "commit": "abc123",
    "build_config": "release",
    "platform": {"os": "linux", "arch": "x86_64"}
  },
  "source_reports": [
    {"id": "S1", "path": "size.json", "source_format": "analyzer-json", "parser": "structured", "confidence": 0.95}
  ],
  "run_context": {"device": "host", "cpu_governor": "unknown", "core_count": 8, "repeat_count": 1, "warmup_count": 0},
  "findings": [
    {
      "id": "F001",
      "kind": "binary-size-large",
      "title": ".text is in the top 5 allocated sections",
      "source_ref": {"source_id": "S1", "locator": "$.sections['.text']", "label": ".text"},
      "actionability": "informational",
      "evidence": {
        "metric": "section_bytes",
        "value": 98304,
        "unit": "bytes",
        "section": ".text",
        "file": "libdemo.so",
        "threshold": {
          "type": "top-n",
          "value": 5,
          "unit": "rank",
          "reason": "top 5 largest allocated sections"
        }
      },
      "diagnosis": "Top-N finding is recorded for size awareness, not direct patching.",
      "confidence": 0.9
    }
  ],
  "provenance": {"generated_by": "m0.5-fixture", "version": "1.0.0", "timestamp": "2026-06-02T00:00:00Z"}
}
