{
  "schema_version": "1.0",
  "report_types": ["hotspot-profile", "binary-size"],
  "target": {
    "name": "demo-decoder",
    "kind": "binary",
    "command": "./demo-decoder sample.bin",
    "repo_root": "/repo/demo",
    "commit": "abc123",
    "build_config": "release",
    "platform": {"os": "linux", "arch": "x86_64", "kernel": "6.8.0"}
  },
  "source_reports": [
    {
      "id": "S1",
      "path": "perf.data",
      "source_format": "analyzer-json",
      "parser": "structured",
      "confidence": 0.95
    }
  ],
  "run_context": {
    "device": "host",
    "cpu_governor": "performance",
    "core_count": 8,
    "affinity": "0-7",
    "thermal_state": "nominal",
    "repeat_count": 5,
    "warmup_count": 1,
    "stat_method": "median",
    "noise_pct": 1.5
  },
  "profiling": {
    "tool": "perf",
    "events": ["cycles"],
    "callgraph_mode": "fp",
    "artifacts": {
      "raw": "perf.data",
      "folded": "out.folded",
      "flamegraph_svg": "flame.svg"
    }
  },
  "findings": [
    {
      "id": "F001",
      "kind": "function-hotspot",
      "title": "decode_block dominates CPU samples",
      "source_ref": {"source_id": "S1", "locator": "$.top[0]", "label": "decode_block"},
      "evidence": {
        "metric": "self_cpu_pct",
        "value": 38.2,
        "unit": "percent",
        "samples": 45000,
        "rank": 1,
        "callers": ["decode_stream"],
        "callees": ["idct_inner"]
      },
      "code_anchors": [
        {
          "symbol": "decode_block",
          "dso": "demo-decoder",
          "file": "src/decode.c",
          "line_start": 120,
          "line_end": 156,
          "language": "c",
          "anchor_confidence": 0.86,
          "resolution_method": "dwarf",
          "evidence": "DWARF line info resolved the sampled function."
        }
      ],
      "bottleneck_class": ["cpu-bound"],
      "diagnosis": "Inner decode loop accounts for the highest self CPU share.",
      "confidence": 0.85,
      "candidate_optimizations": [
        {
          "id": "O1",
          "strategy": "loop-simplification",
          "expected_impact": "medium",
          "confidence": 0.7,
          "risk": "low",
          "rationale": "The loop is local and hot."
        }
      ]
    },
    {
      "id": "F002",
      "kind": "binary-size-large",
      "title": ".rodata is large",
      "source_ref": {"source_id": "S1", "locator": "$.sections[0]", "label": ".rodata"},
      "evidence": {
        "metric": "section_bytes",
        "value": 131072,
        "unit": "bytes",
        "section": ".rodata",
        "file": "demo-decoder",
        "threshold": {
          "type": "absolute-bytes",
          "value": 65536,
          "unit": "bytes",
          "reason": "section exceeds 64KB"
        }
      },
      "diagnosis": "Static lookup tables dominate allocated read-only data.",
      "confidence": 0.9
    }
  ],
  "notes": "M0.5 fixture only; no real perf artifact is required.",
  "provenance": {
    "generated_by": "m0.5-fixture",
    "version": "1.0.0",
    "timestamp": "2026-05-25T00:00:00Z"
  }
}

